{
  "question": "Synthetic example: inspect the scoped method",
  "scope_id": "fixture:scope-1",
  "scope_revision": 1,
  "request_id": "fixture:request-1",
  "available_capabilities": [
    "paper_read_evidence",
    "research_export_skill"
  ],
  "method_spec_id": "fixture:method-1",
  "source_evidence_ids": [
    "fixture:evidence-1"
  ],
  "requested_status": "validated",
  "execution_authorized": false
}
